date,username,to,replies,retweets,favorites,text,geo,mentions,hashtags,id,permalink
2019-11-20 07:06:47,alozie_,ProfOsinbajo,0,2,1,"If he was in Nigeria, your police men would have harassed him because of his hair. You see that hair doesn’t define a man right ? Let us fix up! https://twitter.com/ProfOsinbajo/status/1196688842813825024 …",,,,1197048628982034433,https://twitter.com/alozie_/status/1197048628982034433
2019-11-19 19:04:08,maneluzai,JoeNwagbara,1,0,0,"Is anyone harassed in 2019?",,,,1196866767664111621,https://twitter.com/maneluzai/status/1196866767664111621
2019-11-18 21:12:28,_Temitopebukola,,0,0,0,"Ordered ordinary fan since last week, @JumiaNigeria has been sending me both emails and text messages asking me to rate everything! I feel harassed! It’s honestly too much! I’ve been expecting your agent to call so I can curse him or her out!",,@JumiaNigeria,,1196536674009964545,https://twitter.com/_Temitopebukola/status/1196536674009964545
2019-11-17 05:20:57,jaysuleimann,TemidayoAjibulu,1,0,4,"Is it not amazing... How humans especially Africans use every opportunity to show how barbaric they can be. Yes they messed up but why are they being harassed by the crowd . Like the guy holding the camera wouldn't have done worse",,,,1195934831403814913,https://twitter.com/jaysuleimann/status/1195934831403814913
2019-11-14 18:10:21,Oyeronks,,0,0,0,"I thought Bam said she has been sexually harassed before? Why then is she signed to a rape apologist's business? Make it make sense plis",,,,1195041292192870401,https://twitter.com/Oyeronks/status/1195041292192870401
2019-11-13 17:20:47,estherons,,0,0,0,"Abeg wetin those ECOWAS Countries do when many Africans, especially Nigerians, were killed and harassed in South Africa? But CEO, if not for the border closure, we for no know sey women dey smuggle rice in bras and dross. @LagosTalks913",,@LagosTalks913,,1194666430928769025,https://twitter.com/estherons/status/1194666430928769025
2019-11-13 14:23:23,BrosManney,,0,0,1,"2020 State Budgets Kano-flagship of the North in Revenue N197b ~ $646m Benue-harassed by herdsmen N189b ~ $620m Lagos-being compared with flagship N1168b ~ $3830b Yawa don gaz Kasala don burst Come see oh, Fowl yansh don open! don see!",,,,1194621785288912896,https://twitter.com/BrosManney/status/1194621785288912896
2019-11-12 14:17:47,Dhaarmiie,Smiiley_Angel,0,0,3,"So this one conspired with her boyfriend to kill her roommate that the boyfriend sexually harassed? I'm not even asking God for too much o, but friends that will do half this shit should be immediately removed from my life. https://twitter.com/Smiiley_Angel/status/1077760816391352320 …",,,,1194257990976753671,https://twitter.com/Dhaarmiie/status/1194257990976753671
2019-11-12 11:16:45,DammyOA_,,1,0,2,"The manager left me the customer and started apologising to the tout, ignored my existence. I literally came to get food and I got harassed but its the tout that's his important. Later came to apologise. @ThePlaceFoods @ThePlaceFood You people should fix up.",,@ThePlaceFoods @ThePlaceFood,,1194212431163273217,https://twitter.com/DammyOA_/status/1194212431163273217
2019-11-12 11:07:19,DammyOA_,,1,3,4,"I just remembered how I was harassed at The place on Adeniran Ogunsanya. A tout came and started disturbing me to give him money or buy food for him. I didn't answer him, nigga even offered me kush. I still ignored. -1",,,,1194210055056478208,https://twitter.com/DammyOA_/status/1194210055056478208
2019-11-07 14:50:50,MaverickFitness,,4,6,12,"I dressed this way on the last day of my exams in school after which I ordered Opay to travel home oo. I was fucking stopped and harassed by @NigeriaPolice they called me a yahoo boy and they actually searched me and demanded to search my phone. I didn’t acceptpic.twitter.com/pBCsRxcJ5b – at Unilag",,@NigeriaPolice,,1192454369020653568,https://twitter.com/MaverickFitness/status/1192454369020653568
2019-11-07 11:39:33,fiyin_fo,caessaarr_,1,0,0,"It does, but some of the girls that do this will still come and lie about being harassed",,,,1192406229915705346,https://twitter.com/fiyin_fo/status/1192406229915705346
2019-11-07 09:18:47,fiyin_fo,Lionezz__,1,8,2,"Lmao they’ll now come to twitter and say “this thread is about how a Taxify driver sexually harassed me” https://twitter.com/Lionezz__/status/1192327277356486657 …",,,,1192370802890563585,https://twitter.com/fiyin_fo/status/1192370802890563585
2019-11-05 07:56:04,JoeyAkinloye,,0,0,2,"The Lord giveth sleep to His beloved, not terror or nightmares. If you've been harassed in your dreams, please know it's the devil at work, and that devil has no right to tamper with the rest God gave you. Come &… https://www.instagram.com/p/B4eeROeFuvT/?igshid=rxebnt4y90wg …",,,,1191625211604418560,https://twitter.com/JoeyAkinloye/status/1191625211604418560
2019-11-04 22:33:07,SilasDaramola,rihennys,1,0,0,"So what you're trying to tell us is that because the society favours men than women do we should not look into men being sexually harassed Because right now am really confused",,,,1191483541734985734,https://twitter.com/SilasDaramola/status/1191483541734985734
2019-11-04 19:44:46,MaverickFitness,OpereOluwaseun,1,0,1,"Dem stop me for Opay been harassed because i was dripping.",,,,1191441175871401986,https://twitter.com/MaverickFitness/status/1191441175871401986
2019-11-04 15:46:03,Shakurforreal,_dregg_,1,0,0,"I don't think you understand, Nobody was forced,hit, slapped or touched unruly.Besides the babe didn't tell you she was harassed",,,,1191381097604624384,https://twitter.com/Shakurforreal/status/1191381097604624384
2019-11-04 13:31:39,astar_life,Sydney_Talker,0,0,0,"I don’t get why people are angry about this... the girl in the video didn’t complain or say she was sexually harassed... https://twitter.com/Sydney_Talker/status/1191267279717228545 …",,,,1191347276461031434,https://twitter.com/astar_life/status/1191347276461031434
2019-11-04 11:33:41,IamTayyibah,striipk,2,0,0,"Women who are sexually harassed at work do not have access to civil remedies. The law does not mandate equal remuneration for work of equal value.",,,,1191317589122863104,https://twitter.com/IamTayyibah/status/1191317589122863104
2019-11-02 20:17:53,iamTROL,Ijaw_girl,0,1,0,"The irony of sex ed classes is that most ladies in such classes end up being sexually harassed. Mr Fasakin from Wesley readily comes to mind. https://twitter.com/Ijaw_girl/status/1190186042143465472 …",,,,1190724734478176256,https://twitter.com/iamTROL/status/1190724734478176256
2019-11-01 19:25:39,_TokeA,,0,0,0,"'I was harassed' How were you dressed?",,,,1190349199348502528,https://twitter.com/_TokeA/status/1190349199348502528
2019-10-31 12:39:00,bembe98,SubDeliveryZone,0,0,0,"8yrs ago, I was stopped and harassed by lastma officials, one my way to cover a Locum during environmental sanitation day.They called me a fake doctor, just few weeks after the incident they were rushed into the emergency room following an accident. And there I was .See begging",,,,1189884474718400513,https://twitter.com/bembe98/status/1189884474718400513
2019-10-30 21:38:23,chinwendu__n,,1,2,1,"There’s this story I should write about one day. It’s about being sexual harassed on my first night in a psychiatric hospital. This talk about people justifying sexual harassment and saying the victim should not speak out about it just reminded me of this experience.",,,,1189657829038346240,https://twitter.com/chinwendu__n/status/1189657829038346240
2019-10-30 07:56:11,Adessy09,ayolegal,0,1,4,"Felt? She was obviously harassed... I mean, how on earth will anyone do this???? How???? #psychopath",,,#psychopath,1189450914576371712,https://twitter.com/Adessy09/status/1189450914576371712
2019-10-29 19:31:24,Movinwealth,missjacklene,0,0,2,"If she was bothered. I think it makes sense for her to get down from the car immediately. What if she was rape or harassed. I get the guys point waiting and filming it is just as sick.",,,,1189263483487084544,https://twitter.com/Movinwealth/status/1189263483487084544
2019-10-29 18:51:09,ebelee_,,1,11,42,"Those girls don’t look like they were handcuffed in a police station, they’re under house arrest, being harassed & not being interrogated by the police. If Davido is really going to take legal action, he should go through the right legal process.",,,,1189253355488665602,https://twitter.com/ebelee_/status/1189253355488665602
2019-10-27 11:37:39,Mejitherapper,ChefOpeyemi,0,0,0,"Bro On my way back home o The first was close to my estate They searched me by didn’t see anything as usual Second time I had to go back to lekki to pick up my spare key that same night and I got harassed in Lekki. One with a rifle pushed me around and hit my head on their bus",,,,1188419484207517696,https://twitter.com/Mejitherapper/status/1188419484207517696
2019-10-27 01:13:17,Mejitherapper,im_masterp,1,0,0,"No My hair is black now Funny how they never harassed me when I had an attention seeking hair",,,,1188262359229435905,https://twitter.com/Mejitherapper/status/1188262359229435905
2019-10-27 01:02:53,Mejitherapper,,11,23,94,"I got harassed by SARS twice this night Shit could have gone sideways but thank God it didn’t",,,,1188259741857923072,https://twitter.com/Mejitherapper/status/1188259741857923072
2019-10-25 12:24:04,sirnoxxy,,1,0,4,"I was just harassed my Police officers 30 minutes later they let me go as soon as they heard me say @segalink",,@segalink,,1187706389579390977,https://twitter.com/sirnoxxy/status/1187706389579390977
2019-10-24 19:37:30,KayXlav,,0,0,0,"Commander in Chief of the Armed Forces @MBuhari @NGRPresident how many more citizens need to be harassed & extorted before you #EndSARS DEMENTIA is evident.",,@MBuhari @NGRPresident,#EndSARS,1187453078531903489,https://twitter.com/KayXlav/status/1187453078531903489
2019-10-24 17:50:44,itisperico,SnowChiff,0,1,2,"I was harassed today because i dressed well https://twitter.com/SnowChiff/status/1187316212792987648 …",,,,1187426208830631936,https://twitter.com/itisperico/status/1187426208830631936
2019-10-23 23:46:24,TheRichardSmyth,chelseareefer,0,0,0,"If you have not been harassed by #Sarz in Lagos,Nigeria. Thank Jehovah!https://twitter.com/chelseareefer/status/1187144978255900673 …",,,#Sarz,1187153329580859401,https://twitter.com/TheRichardSmyth/status/1187153329580859401
2019-10-22 09:09:10,gomaro101,KemiOlunloyo,0,0,1,"Sexually harassed you? Wow!",,,,1186570177787375616,https://twitter.com/gomaro101/status/1186570177787375616
2019-10-22 07:22:59,oyin_debby,palms92413113,2,0,0,"Why? Because it's Bobrisky? I hope people keep the same energy when you're being harassed like this too",,,,1186543456790990849,https://twitter.com/oyin_debby/status/1186543456790990849
2019-10-21 17:28:52,mysteriouseyess,,3,2,4,"The way some yoruba guys harassed me today at yaba market ehn, I would be needing a stun gun next time I visit that area. I didn’t know having big breast is now a crime.",,,,1186333544395821058,https://twitter.com/mysteriouseyess/status/1186333544395821058
2019-10-21 17:17:05,Agbejoro_,SubDeliveryZone,1,2,3,"Reading the comments and I am amazed that Nigerians don't know that Generals can be brought to book. Let me share a small story. One of my client was harassed by a general because his gf her neighbor complained to him about her. Baba sent his orderly to lock them up.",,,,1186330580084056065,https://twitter.com/Agbejoro_/status/1186330580084056065
2019-10-20 15:16:51,ajigzy,iam_fasho,1,0,0,"Sigh It is well, it's not the church she.. It's the individual differences, I've been harassed by people cos I was using left hand while in school.",,,,1185937933523652608,https://twitter.com/ajigzy/status/1185937933523652608
2019-10-20 13:31:00,eniolaoyetunde,Ohloowatoscene,0,0,0,"1 o.... I also want to be harassed by etc n sars",,,,1185911296824369152,https://twitter.com/eniolaoyetunde/status/1185911296824369152
2019-10-19 08:18:00,Ogbeni_Adewale,,0,0,0,"In Nigeria. The common man is oppressed by the elected, harassed and extort by those who are to protect him and robbed by his fellows. Is there really a hope for the common man?",,,,1185470136872030208,https://twitter.com/Ogbeni_Adewale/status/1185470136872030208
2019-10-17 13:05:21,afolabiodun,SaharaReporters,0,0,4,"Ask them to name one person this Buhari has harassed... You will start hearing them mentioning: Sowore; that called for a government to be toppled. Dasuki; that is in court for what could have easily passed as war crimes, and El zakzaki; whose group doesn't respect Nigeria. Smh https://twitter.com/SaharaReporters/status/1184810387134472194 …",,,,1184817676981547014,https://twitter.com/afolabiodun/status/1184817676981547014
2019-10-17 10:30:26,satinsola,,1,0,0,"..... and apologised and told me it is their modus operandi. I told him that process is a misnormal and left off. While in the cab and lamenting, the cab driver narrated how innocent citizens are being harassed and extorted. Another cab occupant narrated his brother's experience",,,,1184778691391434752,https://twitter.com/satinsola/status/1184778691391434752
2019-10-17 08:26:15,DaramolaMike22,,1,0,0,"@getoride @OPay_NG, can u guys pls find a lasting solution to the issues of ticket buying in Lagos? The way riders and customers are bring harassed is getting outta hand. Pls do something permanent about it. Thanks",,@getoride @OPay_NG,,1184747436805427200,https://twitter.com/DaramolaMike22/status/1184747436805427200
2019-10-14 14:56:29,Berrynelly,,0,0,1,"#SexForGrades: ""Expose me if I have sexually harassed you- Nigerian lecturer challenges his students http://nellyudoh.blogspot.com/2019/10/sexforgrades-expose-me-if-i-have.html?m=1 … #Titans4Tacha #Omashola39 #justiceforkano9 #mondaythoughts",,,#SexForGrades #Titans4Tacha #Omashola39 #justiceforkano9 #mondaythoughts,1183758479858774030,https://twitter.com/Berrynelly/status/1183758479858774030
2019-10-14 13:33:06,Naijapals,,2,4,10,"Expose Me If I Have Sexually Harassed You- Lecturer, Aliyu Maigado Challenges His Students https://www.gistmania.com/talk/topic,403397.0.html?utm_source=dlvr.it&utm_medium=twitter …",,,,1183737494602301441,https://twitter.com/Naijapals/status/1183737494602301441
2019-10-14 11:35:31,Ahoefamimz,,1,1,7,"I’m still thinking about what Mr Kofi Kapito said to @Serwaa_Amihere. She felt offended about the comment ( compliment) and so let’s stop lashing out at her. Until you find yourself in a situation like that you won’t know how it feels to be harassed verbally and (nicely).",,@Serwaa_Amihere,,1183707906010746880,https://twitter.com/Ahoefamimz/status/1183707906010746880
2019-10-14 05:38:48,_Brayz,Irepbuksi,1,0,0,"Exactly what I’m saying. The girl has been typing about how he harassed or sent someone to harass them. The Tega bodyguard babe too woulda been tweeting about how he almost beat them",,,,1183618133929709569,https://twitter.com/_Brayz/status/1183618133929709569
2019-10-14 04:37:35,Kloud_official,,0,2,7,"IF YOU PUBLICLY LIE ABOUT BEING SEXUALLY HARASSED, YOU SHOULD BE JAILED!!!!!!!!",,,,1183602729450639360,https://twitter.com/Kloud_official/status/1183602729450639360
2019-10-13 20:47:58,chef_yinda,Ola__Lawal,0,0,0,"read a thread of a girl that got sexually harassed today,nothing irked me more than the fact that everyone commenting kept blaming her for ‘visiting’ in d first place,apparently she’d been talking to the said guy for a while Nd sort of trusted him enough,come on! Guys do better!",,,,1183484544273567744,https://twitter.com/chef_yinda/status/1183484544273567744
2019-10-13 00:36:27,OlaOfLife,,1,15,1,"I have just been harassed by these SARS on Ligali Ayorinde VI",,,,1183179656712904705,https://twitter.com/OlaOfLife/status/1183179656712904705
2019-10-11 07:02:38,oluvercetti,,1,0,0,"@getoride @OPay_NG Your riders are currently being harassed by policemen at Adetokunbo Ademola traffic light",,@getoride @OPay_NG,,1182552070194450432,https://twitter.com/oluvercetti/status/1182552070194450432
2019-10-10 21:12:24,itsfynegal,Nne_dynma,0,0,1,"Who sexually harassed who Let's see the video clip You shameless liars He has his own lady It's not his fault your candidate was disqualified You decampaigned him and you failed He saw the day 99 Won http://One.org You want to be unfortunate with your hate campaign",,,,1182403529769717768,https://twitter.com/itsfynegal/status/1182403529769717768
2019-10-09 13:29:52,KingJamez_,,0,3,1,"After showing my mum the #SexForGrades video, she said she wasn’t surprised about the pastor and she shared her experience with me back when she was in school how 2 lecturers sexually harassed her and one of them was a priest in a Catholic Church. I weak",,,#SexForGrades,1181924743164903425,https://twitter.com/KingJamez_/status/1181924743164903425
2019-10-09 08:59:04,timisoleye,ozzyetomi,0,0,0,"I have gotten harassed at successive offices in Nigeria even when I have my head phones in. It’s always “are you busy?” And I’m like",,,,1181856593002012673,https://twitter.com/timisoleye/status/1181856593002012673
2019-10-09 06:50:24,newtonodunsi,drpenking,0,0,0,"Getting harassed by DSS and the Law that's supposed to protect them. https://twitter.com/drpenking/status/1181479095609315328 …",,,,1181824215726641152,https://twitter.com/newtonodunsi/status/1181824215726641152
2019-10-09 06:23:13,aikmamah,SeunnlaAdelusi,2,0,0,"The specificity here is sexual harassment not University How would you feel if someone you know is sexually harassed in school and she gets justice and you are sexually harassed at work and you are told the law doesn't cover you. I'd also like to learn were it was effective",,,,1181817371356532736,https://twitter.com/aikmamah/status/1181817371356532736
2019-10-09 06:13:54,newtonodunsi,drpenking,0,0,0,"Getting arrested and harassed by DSS and the Judiciary",,,,1181815026623102976,https://twitter.com/newtonodunsi/status/1181815026623102976
2019-10-08 20:40:27,SunmboAdeoye,,2,2,18,"I empathize with all the female students who are molested yearly and are constantly being harassed by their Male lecturers who has the power to make or mar their grades in college. May you find justice in Jesus name.",,,,1181670713800953860,https://twitter.com/SunmboAdeoye/status/1181670713800953860
2019-10-08 19:57:30,Eseosa__,,1,0,1,"If harassment truly is caused by clothing, you would think that hijabis wouldn't get raped/harassed/killed, wouldn't you? But no. They get killed too.",,,,1181659907273187328,https://twitter.com/Eseosa__/status/1181659907273187328
2019-10-08 16:09:24,temmybanjo1,,3,0,0,"Next time all these men come to cry on twitter that SARS harassed them and exploited them, we’ll ask them what they were wearing and why they were attracting SARS with their dressing. Or we can even say “avoid these SARS” Or we say dress responsibly",,,,1181602503776985088,https://twitter.com/temmybanjo1/status/1181602503776985088
2019-10-08 16:00:40,osynachi_1,PremiumTimesng,0,0,1,"That's not the problem. Let them open a platform and ask students who have been sexually harassed to open up. This bastard should be dealt with. Enough is enough https://twitter.com/PremiumTimesng/status/1181261207325548545 …",,,,1181600306779607040,https://twitter.com/osynachi_1/status/1181600306779607040
2019-10-08 14:38:04,DammyOA_,,2,10,16,"Let me say this again and again. All the names I mentioned harassed Students. Thank you for coming to my pep talk #Babcocksexforgrades",,,#Babcocksexforgrades,1181579520056463360,https://twitter.com/DammyOA_/status/1181579520056463360
2019-10-08 14:34:07,AdaMissTourism,tokstarr,0,2,20,"It’s so disturbing!!! Even from secondary school!! At Queens college our biology teacher harassed almost everyone in class",,,,1181578523963744256,https://twitter.com/AdaMissTourism/status/1181578523963744256
2019-10-08 10:07:29,E_L_xo,SubDeliveryZone,10,27,60,"I school in yaba tech and I can tell you first hand that dressing decently still doesn’t stop you from being harassed. https://twitter.com/SubDeliveryZone/status/1181499609727819776 …",,,,1181511423349932035,https://twitter.com/E_L_xo/status/1181511423349932035
2019-10-08 09:53:20,real__OFA,,0,0,0,"Most people think this #SexforGrade this only affect female student, well i won't gist you here, just know that some male students are also affected, they also get harassed by female lecturers as well....",,,#SexforGrade,1181507861966446592,https://twitter.com/real__OFA/status/1181507861966446592
2019-10-08 09:04:58,derickchoc,diipoyourmii,0,0,0,"That one is a numb skull. Even people who wear Niqob still get harassed.",,,,1181495689651654656,https://twitter.com/derickchoc/status/1181495689651654656
2019-10-08 08:21:04,MarkOtabor,Lola_OJ,1,0,2,"Lola you are taking this issue personal, when it has to do with ladies dont think people are insensitive, I had a friend that was harassed back in school, it was a crazy battle back in school so when people voice out sometimes they are talking from different experiences!",,,,1181484642442125312,https://twitter.com/MarkOtabor/status/1181484642442125312
2019-10-08 08:05:50,OgeChikero,,0,0,1,"#SexForGrades: I was sexually harassed in the university - Governor Fayemi’s wife, Bisi https://www.naijanewsng.com/sexforgrades-i-was-sexually-harassed-in-the-university-governor-fayemis-wife-bisi/ … @ekitistategov",,@ekitistategov,#SexForGrades,1181480810433646593,https://twitter.com/OgeChikero/status/1181480810433646593
2019-10-08 07:01:35,tennyalpha,durrybeez,1,0,0,"You Know the finance devil harassed my ex that time... na still another dr & my aunt(faculty officer) go beg am.",,,,1181464640565460992,https://twitter.com/tennyalpha/status/1181464640565460992
2019-10-08 05:39:41,BBoason,IgboOlodumare,2,5,9,"A brand new 2007 automobile imported in 2017 and bought from one of the most largest, oldest car dealer in Lagos in 2018, was stopped by the Customs near Ibadan tollgate, and driver harassed that duty wasn't (fully) paid.",,,,1181444028757368832,https://twitter.com/BBoason/status/1181444028757368832
2019-10-08 04:58:57,pr_eyo,,0,0,1,"May God not only punish every wolfs like men using their position or office to sexually harassed nor molest any lady in secret anymore but expose and shame them publicly and to any #RAPIST Jesus name. AMEN. #Sexforgrade",,,#RAPIST #Sexforgrade,1181433780348866560,https://twitter.com/pr_eyo/status/1181433780348866560
2019-10-07 23:29:52,olu_blaq,,0,0,0,"Work Colleagues narrated how they were sexually harassed by family members.... secondary scho teachers.... It broke my heart I couldn't talk...how could someone do such... ...",,,,1181350962608431105,https://twitter.com/olu_blaq/status/1181350962608431105
2019-10-07 21:57:55,MuyiwaWilliams_,,0,0,0,"It really Sucks to see Teenagers of these days going through Early Heartbreak because most of their Older Cousins have already Harassed before turning 18.",,,,1181327823165906944,https://twitter.com/MuyiwaWilliams_/status/1181327823165906944
2019-10-07 21:08:39,VickyJay__,,0,2,1,"Male Students get sexually harassed too!!! Male students get sexually harassed too!!! Male students get sexually harassed too!!! Male students get sexually harassed too!!! Male students get sexually harassed too!!! Male students get sexually harassed too!!! #sexforgrades",,,#sexforgrades,1181315422857113600,https://twitter.com/VickyJay__/status/1181315422857113600
2019-10-07 21:08:13,VickyJay__,,0,1,1,"Male Students get sexually harassed too!!! Male students get sexually harassed too!!! Male students get sexually harassed too!!! Male students get sexually harassed too!!! Male students get sexually harassed too!!! Male students get sexually harassed too!!!",,,,1181315312836321288,https://twitter.com/VickyJay__/status/1181315312836321288
2019-10-07 20:30:05,chef_yinda,,1,1,6,"A lot of ladies got abused and sexually harassed in school for grades,some even did it and never still got the so called grades,we can’t keep forgiving please! Time to drag them!",,,,1181305719972335617,https://twitter.com/chef_yinda/status/1181305719972335617
2019-10-07 19:32:04,iamchristiana_,,0,0,0,"Molested at home, harassed on the streets, assaulted at work, school. When do we get a break?? When you kill us???",,,,1181291118434099200,https://twitter.com/iamchristiana_/status/1181291118434099200
2019-10-07 18:11:14,Women__Leader,,0,1,1,"@SOUNDCITYEnugu I am glad that such an amazing journalist took such a daring step. But I have a problem with the aftermath of this and our justice system. We have heard of rapists that only paid a fine and are out in the street. Boys get harassed too o, let’s not forget please.",,@SOUNDCITYEnugu,,1181270774562340864,https://twitter.com/Women__Leader/status/1181270774562340864
2019-10-07 17:40:17,Zubairthedream,,1,4,4,"As we speak, people are being trafficked, harassed, exploited, sold into slavery, trafficked for their organs, married off or being killed (or denied a right to live). Why do we do these things to ourselves? To what end?",,,,1181262985320435718,https://twitter.com/Zubairthedream/status/1181262985320435718
2019-10-07 15:17:08,FoyeA_,,1,0,0,"Lol Faculty of Arts that the lecturers will knack and some will still fail you after they knack... You will now carry 3rd class join after being harassed to open leg .. Special place beside the devil in hell o That one in I think BusAd that begs girls to let him give them",,,,1181226961454059520,https://twitter.com/FoyeA_/status/1181226961454059520
2019-10-07 13:22:01,deolar_,,0,0,0,"... like it’s their fault for getting sexually harassed. Long overdue but I’m beyond excited in this movement for #SexforGrades Tell your daddies and uncles that indulge in this madness that nemesis will catch up with them soonest!",,,#SexforGrades,1181197993028001793,https://twitter.com/deolar_/status/1181197993028001793
